id;question_id;question;a;b;c;d;correct;image;image_fallback;category_id
;305;305. Baza danych księgarni zawiera tabelę ksiazki z polami: id, idAutor, tytul, ileSprzedanych oraz tabelę autorzy z polami: id, imie, nazwisko. Aby stworzyć raport sprzedanych książek z tytułami i nazwiskami autorów, należy;stworzyć kwerendę wyszukującą tytuły książek;Zdefiniować relację 1..n dla tabel ksiazki i autorzy, a następnie stworzyć kwerendę łączącą obie tabele;Zdefiniować relację 1..1 dla tabel ksiazki i autorzy, a następnie stworzyć kwerendę łączącą obie tabele;stworzyć dwie osobne kwerendy: pierwszą wyszukującą tytuły książek, drugą wyszukującą nazwiska autorów;B;;;202
;306;306. Istnieje tabela pracownicy z polami: id, imie, nazwisko, pensja. W nowym roku postawiono podnieść pensję wszystkim pracownikom o 100 zł. Aktualizacja ta w bazie danych będzie miała postać;"UPDATE pracownicy SET pensja = pensja + 100;";"UPDATE pracownicy SET pensja = 100;";"UPDATE pensja SET +100;";"UPDATE pensja SET 100;";A;;;202
;307;307. W tabeli artykuly wykonano następujące polecenia dotyczące praw użytkowania jan. Po wykonaniu poleceń użytkownik jan będzie miał prawa do;tworzenia tabeli i aktualizowania w niej danych;aktualizowania danych i przeglądania tabeli;tworzenia tabeli i wypełniania jej danymi;przeglądania tabeli;C;images/307.jpg;https://www.praktycznyegzamin.pl/inf03ee09e14/teoria/wszystko/e14/307.jpg;207
;308;308. Aby przywrócić bazę danych MS SQL z kopii bezpieczeństwa, należy zastosować polecenie;DBCC CHECKDB;SAVE DATABASE;RESTORE DATABASE;REBACKUP DATABASE;C;;;205
;309;309. Baza danych MySQL uległa uszkodzeniu. Które z działań NIE pomoże przy jej naprawie?;Wykonanie replikacji bazy danych;Próba naprawy poleceniem REPAIR;Odtworzenie bazy z kopii bezpieczeństwa;Stworzenie nowej bazy i przeniesienie do niej tabel;A;;;205
;310;310. W formularzu, dane z pola input o typie number zostały zapisane do zmiennej a, a następnie przetworzone w skrypcie JavaScript w następujący sposób. Zmienna x będzie typu;NaN;napisowego;zmiennoprzecinkowego;liczbowego, całkowitego;D;images/310.jpg;https://www.praktycznyegzamin.pl/inf03ee09e14/teoria/wszystko/e14/310.jpg;201
;311;311. Wstawki kodu JavaScript w dokumencie HTML mogą się znaleźć;tylko w cześci <head>, w znaczniku <script>;tylko w cześci <body>, w znaczniku <java>;zarówno w cześci <head>, jak i <body>, w znaczniku <java>;zarówno w cześci <head>, jak i <body>, w znaczniku <script>;D;;;201
;312;312. W przedstawonym kodzie JavaScript dla ułatwienia ponumerowano linie. W kodzie znajduje się błąd, gdyż po uruchomieniu żaden komunikat nie zostaje wyświetlony. Aby wyeliminować błąd, należy;wstawić znaki $ przed nazwami zmiennych.;wstawić nawiasy klamrowe do sekcji if oraz else;w liniach 2 i 5 zmienne a i b wstawić w cudzysłów;w liniach 3 i 6 zamienić znaki cudzysłowu na apostrof, np. ’jest mniejsze’;B;images/312.jpg;https://www.praktycznyegzamin.pl/inf03ee09e14/teoria/wszystko/e14/312.jpg;203
;313;313. Ile iteracji będzie miała przedstawiona pętla zapisana w języku PHP, zakładając, że zmienna sterująca nie jest modyfikowana we wnętrzu pętli?;0;10;11;Nieskończenie wiele;C;images/313.jpg;https://www.praktycznyegzamin.pl/inf03ee09e14/teoria/wszystko/e14/313.jpg;203
;314;314. W języku JavaScript metoda document.getElementById(id) ma za zadanie;wstawić tekst o treści ’id’ na stronie WWW;sprawdzić poprawność formularza o identyfikatorze id;pobrać dane z pola formularza i wstawić je do zmiennej id;zwrócić odniesienie do pierwszego elementu HTML o podanym id;D;;;203
;315;315. W instrukcji warunkowej JavaScript należy sprawdzić przypadek, gdy zmienne a oraz b są dodatnie, z czego zmienna b jest mniejsza od 100. Warunek taki powinien być zapisany w następujący sposób:;if ( a > 0 || b > 0 || b > 100);if ( a > 0 && b > 0 || b > 100);if ( a > 0 || (b > 0 && b < 100));if ( a > 0 && b > 0 && b < 100);D;;;203
;316;316. Zadaniem przedstawionej funkcji zapisanej w języku JavaScript jest;zwrócenie wartości parzystych liczb od a do b;wypisanie liczb parzystych z przedziału od a do b;wypisanie wszystkich liczb z przedziału od a do b;"sprawdzenie, czy liczba a jest nieparzysta; jeśli tak, wypisanie jej";B;images/316.jpg;https://www.praktycznyegzamin.pl/inf03ee09e14/teoria/wszystko/e14/316.jpg;203
;317;317. Przedstawiony kod został zapisany w języku JavaScript. W podanej definicji obiektu metodą jest element o nazwie;obj1;oblicz;czescCalkowita;czescUlamkowa;B;images/317.jpg;https://www.praktycznyegzamin.pl/inf03ee09e14/teoria/wszystko/e14/317.jpg;203
;318;318. Aby uzyskać informacje o środowisku pracy serwera obsługującego PHP, należy skorzystać z funkcji;php();phpinfo();phpgetinfo();phpinformation();B;;;201
;319;319. Fragment kodu w języku PHP wypisze;"nazwę konta ze znakiem @, czyli ""adres@""";"cały adres e-mail, czyli "" [email protected] """;"samą nazwę domeny, czyli ""host.pl""";"samą nazwę konta, czyli ""adres""";D;images/319.jpg;https://www.praktycznyegzamin.pl/inf03ee09e14/teoria/wszystko/e14/319.jpg;204
;320;320. Do uruchomienia skryptu JavaScript wymagane jest oprogramowanie;serwera WWW;serwera MySQL;debugera JavaScript;przeglądarki internetowej;D;;;203
;321;321. Zadaniem funkcji PHP o nazwie mysql_select_db() jest;połączyć bazę danych z serwerem SQL;określić bazę, z której będą pobierane dane;określić tabelę, z której będą pobierane dane;pobrać dane z bazy danych na podstawie kwerendy;B;;;205
;322;322. W przedstawionym kodzie PHP, zamiast znaków zapytania powinien pojawić się komunikat:;Błąd przetwarzania zapytania;Zapytanie przetworzono pomyślnie;Nieprawidłowa nazwa bazy danych;Nieprawidłowe hasło do bazy danych;A;images/322.jpg;https://www.praktycznyegzamin.pl/inf03ee09e14/teoria/wszystko/e14/322.jpg;204
;323;323. Testy wydajnościowe mają na celu sprawdzenie;zdolności oprogramowania do działania w warunkach wadliwej pracy sprzętu;zdolności oprogramowania do działania w warunkach wadliwej pracy systemu;stopnia spełnienia wymagań wydajnościowych przez system lub moduł;ciągu zdarzeń, w którym prawdopodobieństwo każdego zdarzenia zależy jedynie od wyniku poprzedniego;C;;;207
;324;324. Aby prawidłowo udokumentować przedstawioną linię kodu języka JavaScript, należy po znakach // wpisać komentarz;nieprawidłowe dane;zmiana stylu atrybutu innerHTML;"wyświetlenie tekstu ""Date()"" w znaczniku o id = napis";wyświetlenie daty i czasu w znaczniku o id = napis;D;images/324.jpg;https://www.praktycznyegzamin.pl/inf03ee09e14/teoria/wszystko/e14/324.jpg;202
;325;325. Przekierowanie 301 służące przekierowaniu użytkownika z jednego adresu URL na inny można ustawić w pliku konfiguracji serwera Apache o nazwie;conf.php;.htaccess;.apacheConf;configuration.php;B;;;207
;326;326. W języku HTML aby zdefiniować słowa kluczowe strony, należy użyć zapisu;"<meta keywords=""psy, koty, gryzonie"">";"<meta name=""keywords"" =""psy, koty, gryzonie"">";"<meta name=""keywords"" content=""psy, koty, gryzonie"">";"<meta name=""description"" content=""psy, koty, gryzonie"">";C;;;201
;327;327. W języku HTML zdefiniowano znacznik a. Wartość nofollow atrybutu rel;oznacza, że kliknięcie na link nie przeniesie do strony website.com;oznacza, że kliknięcie na link otworzy go w osobnej karcie przeglądarki;jest informacją dla robota wyszukiwarki Google, aby nie podążał za tym linkiem;"jest informacją dla przeglądarki internetowej, aby nie formatowała słowa ""link"" jako odnośnika";C;images/327.jpg;https://www.praktycznyegzamin.pl/inf03ee09e14/teoria/wszystko/e14/327.jpg;201
;328;328. W języku HTML aby zdefiniować poziomą linię, należy użyć znacznika;<line>;<br>;<hl>;<hr>;D;;;201
;329;329. Zapisano kod HTML wstawiający grafikę na stronę internetową. Jeżeli rysunek.png nie zostanie odnaleziony, przeglądarka;nie wyświetli strony internetowej;"w miejscu grafiki wypisze tekst ""pejzaż""";"w miejscu grafiki wypisze tekst ""rysunek.png""";w miejscu grafiki wypisze błąd wyświetlania strony;B;images/329.jpg;https://www.praktycznyegzamin.pl/inf03ee09e14/teoria/wszystko/e14/329.jpg;201
;330;330. Aby w języku HTML uzyskać takie formatowanie paragrafu dla tekstu należy zastosować kod;<p>Tekst może być <mark>zaznaczony</mark> albo <em>istotny dla autora</p>;<p>Tekst może być <mark>zaznaczony albo <i>istotny</i> dla autora</mark></p>;<p>Tekst może być <mark>zaznaczony</mark> albo <em>istotny</em> dla autora</p>;<p>Tekst może być <mark>zaznaczony albo <em>istotny</em> dla autora</mark></p>;C;images/330.jpg;https://www.praktycznyegzamin.pl/inf03ee09e14/teoria/wszystko/e14/330.jpg;201
;331;331. Zamieszczony kod HTML formularza zostanie wyświetlony przez przeglądarkę w sposób:;A;B;C;D;D;images/331.jpg;https://www.praktycznyegzamin.pl/inf03ee09e14/teoria/wszystko/e14/331.jpg;201
;332;332. W języku CSS wcięcie pierwszej linii akapitu na 30 pikseli uzyska się za pomocą zapisu;"p { text-indent: 30px; }";"p { text-spacing: 30px; }";"p { line-height: 30px; }";"p { line-indent: 30px; }";A;;;202
;333;333. W języku CSS zdefiniowano następujące formatowanie. Kolorem czerwonym zostanie zapisany;tylko tekst pochylony nagłówka pierwszego stopnia;tylko tekst pochylony we wszystkich poziomach nagłówków;cały tekst nagłówka pierwszego stopnia oraz pochylony tekst akapitu;cały tekst nagłówka pierwszego stopnia oraz cały tekst pochylony, niezależnie od tego, w którym miejscu strony się znajduje;A;images/333.jpg;https://www.praktycznyegzamin.pl/inf03ee09e14/teoria/wszystko/e14/333.jpg;202
;334;334. W języku CSS, aby sformatować dowolny element języka HTML w ten sposób, że po najechaniu na niego kursorem zmienia on kolor czcionki, należy zastosować pseudoklasę;:active;:hover;:visited;:coursor;B;;;201
;335;335. Zapis CSS w takiej postaci sprawi, że na stronie internetowej;punktorem listy nienumerowanej będzie rys.gif;rys.gif będzie stanowił ramkę dla listy nienumerowanej;wyświetli się rys.gif jako tło listy nienumerowanej;każdy z punktów listy będzie miał osobne tło pobrane z grafiki rys.gif;A;images/335.jpg;https://www.praktycznyegzamin.pl/inf03ee09e14/teoria/wszystko/e14/335.jpg;202
;336;336. W języku CSS aby zdefiniować odmienne formatowanie dla pierwszej litery akapitu, należy zastosować selektor;klasy p.first-letter;dziecka p + first-letter;atrybutu p [first-letter];pseudoelementu p::first-letter;D;;;202
;337;337. W kodzie źródłowym zapisanym w języku HTML wskaż błąd walidacji dotyczący tego fragmentu;Nieznany znacznik h6;Znacznik br nie został poprawnie zamknięty;Znacznik br nie może występować wewnątrz znacznika p;Znacznik zamykający /b niezgodny z zasadą zagnieżdżania;D;images/337.jpg;https://www.praktycznyegzamin.pl/inf03ee09e14/teoria/wszystko/e14/337.jpg;201
;338;338. W ramce przedstawiono właściwości pliku graficznego. W celu optymalizacji czasu ładowania rysunku na stronę WWW należy;zmniejszyć wymiary rysunku;zwiększyć rozdzielczość;zmienić format grafiki na CDR;zmienić proporcje szerokości do wysokości;A;images/338.jpg;https://www.praktycznyegzamin.pl/inf03ee09e14/teoria/wszystko/e14/338.jpg;207
;339;339. W programie INKSCAPE / COREL aby uzyskać przedstawiony efekt napisu, należy;skorzystać z funkcji gradientu;zastosować funkcję sumy z kołem;zastosować funkcję wykluczenia z kołem;skorzystać z funkcji wstaw / dopasuj tekst do ścieżki;D;images/339.jpg;https://www.praktycznyegzamin.pl/inf03ee09e14/teoria/wszystko/e14/339.jpg;207
;340;340. Programem do edycji dźwięku jest;Brasero;Winamp;Audacity;RealPlayer;C;;;206
;341;341. Dana jest tabela pracownicy. Polecenie MySQL usuwające wszystkie rekordy z tabeli, dla których nie wypełniono pola rodzaj_umowy, ma postać;"DROP pracownicy FROM rodzaj_umowy = 0;";"DROP pracownicy WHERE rodzaj_umowy IS NULL;";"DELETE pracownicy WHERE rodzaj_umowy = 'brak';";"DELETE FROM pracownicy WHERE rodzaj_umowy IS NULL;";D;;;205
;342;342. W języku SQL, aby stworzyć tabelę, należy zastosować polecenie;ADD TABLE;ALTER TABLE;INSERT TABLE;CREATE TABLE;D;;;205
;343;343. W przedstawionym fragmencie kwerendy języka SQL, komenda SELECT ma za zadanie zwrócić;średnią tabeli;liczbę wierszy;sumę w kolumnie wartosc;średnią w kolumnie wartosc;B;images/343.jpg;https://www.praktycznyegzamin.pl/inf03ee09e14/teoria/wszystko/e14/343.jpg;205
;344;344. Dana jest tabela ksiazki z polami: tytul, autor (typu tekstowego), cena (typu liczbowego). Aby kwerenda SELECT zwróciła tylko tytuły, dla których cena jest mniejsza od 50zł, należy zapisać:;"SELECT * FROM ksiazki WHERE cena < 50;";"SELECT tytul FROM ksiazki WHERE cena < 50;";"SELECT tytul FROM ksiazki WHERE cena > '50 zł';";"SELECT ksiazki FROM tytul WHERE cena < '50 zł';";B;;;205
;345;345. W bazie danych MYSQL dana jest tabela programów komputerowych o polach: nazwa, producent, rokWydania. Aby kwerenda SELECT zwróciła wszystkie nazwy producentów tak, by nazwy te nie powtarzały się, należy zapisać:;"SELECT UNIQUE producent FROM programy;";"SELECT DISTINCT producent FROM programy;";"SELECT producent FROM programy WHERE UNIQUE;";"SELECT producent FROM programy WHERE producent NOT DUPLICATE;";B;;;205
;346;346. Tabela filmy zawiera klucz główny id oraz klucz obcy rezyserID. Tabela rezyserzy zawiera klucz główny id. Obydwie tabele połączone są relacją jeden po stronie rezyserzy do wielu po stronie filmy. Aby w kwerendzie SELECT połączyć tabele filmy i rezyserzy, należy zapisać;... filmy JOIN rezyserzy ON filmy.id = rezyserzy.id ...;... filmy JOIN rezyserzy ON filmy.id = rezyserzy.filmyID ...;... filmy JOIN rezyserzy ON filmy.rezyserID = rezyserzy.id ...;... filmy JOIN rezyserzy ON filmy.rezyserID = rezyserzy.filmyID ...;C;;;205
;347;347. Na rysunku przedstawiono dwie tabele. Aby połączyć je relacją jeden do wielu, jeden po stronie Klienci wiele po stronie Zamowienia, należy;Połączyć relacją pola ID z obu tabel;Dodać pole klucza obcego do tabeli Zamowienia i połączyć je z ID tabeli Klienci;Dodać pole klucza obcego do tabeli Klienci i połączyć je z ID tabeli Zamowienia;Zdefiniować trzecią tabelę z dwoma kluczami obcymi. Jeden klucz połączyć z ID tabeli Klienci, drugi klucz połączyć z ID tabeli Zamowienia;B;images/347.jpg;https://www.praktycznyegzamin.pl/inf03ee09e14/teoria/wszystko/e14/347.jpg;207
;348;348. Źródłem rekordów dla raportu może być;Tabela;Inny raport;Makropolecenie;Zapytanie INSERT INTO;A;;;207
;349;349. Przedstawione polecenie MySQL ma za zadanie;Usunąć kolumnę tytul z tabeli ksiazki;Dodać do tabeli ksiazki kolumnę tytul;Zmienić nazwę kolumny w tabeli ksiazki;Zmienić typ kolumny w tabeli ksiazki;D;images/349.jpg;https://www.praktycznyegzamin.pl/inf03ee09e14/teoria/wszystko/e14/349.jpg;205
;350;350. W tabeli podzespoly należy zmienić wartość pola URL na 'toshiba.pl' dla wszystkich rekordów, gdzie pole producent to TOSHIBA. W języku SQL modyfikacja będzie miała postać;"UPDATE podzespoly SET URL='toshiba.pl';";"UPDATE producent='TOSHIBA' SET URL='toshiba.pl';";"UPDATE podzespoly.producent='TOSHIBA' SET URL='toshiba.pl';";"UPDATE podzespoly SET URL='toshiba.pl' WHERE producent='TOSHIBA';";D;;;205
;351;351. Do zabezpieczeń serwera bazy danych przed atakami hakerów nie należy;Włączenie zapory;Defragmentacja dysków;Stosowanie złożonych haseł do bazy;Blokowanie portów związanych z bazą danych;B;;;207
;352;352. W języku MySQL należy zastosować polecenie REVOKE, aby użytkownikowi anna odebrać prawo do dokonywania zmian jedynie w definicji struktury bazy danych. Polecenie odpowiadające odebraniu tych praw ma postać;REVOKE ALL ON tabela1 FROM 'anna'@'localhost';REVOKE CREATE ALTER DROP ON tabela1 FROM 'anna'@'localhost';REVOKE CREATE UPDATE DROP ON tabela1 FROM 'anna'@'localhost';REVOKE CREATE INSERT DELETE ON tabela1 FROM 'anna'@'localhost';B;;;205
;353;"353. W języku JavaScript, aby sprawdzić warunek czy liczba znajduje się w przedziale (100;200>, należy zapisać:";if (liczba > 100 || liczba <= 200);if (liczba < 100 || liczba >= 200);if (liczba > 100 && liczba <= 200);if (liczba < 100 && liczba <= 200);C;;;203
;354;354. W wyniku działania pętli zapisanej w języku PHP zostanie wypisany ciąg liczb;10 15 20 25 30 35 40 45;10 15 20 25 30 35 40 45 50;0 5 10 15 20 25 30 35 40 45;0 5 10 15 20 25 30 35 40 45 50;A;images/354.jpg;https://www.praktycznyegzamin.pl/inf03ee09e14/teoria/wszystko/e14/354.jpg;204
;355;355. Które z poniższych zdań dotyczących zasad programowania w języku PHP jest prawdziwe?;Jest to język o słabej kontroli typów;Nazwy zmiennych są poprzedzone znakiem !;Deklaracja zmiennych następuje po słowie var;W nazwach zmiennych nie jest rozróżniana wielkość liter;A;;;204
;356;356. W języku PHP instrukcja foreach jest instrukcją;Wyboru, dla elementów tablicy;Pętli, niezależnie od typu zmiennej;Pętli, wyłącznie dla elementów tablicy;Warunkową, niezależnie od typu zmiennej;C;;;204
;357;357. Funkcją języka PHP tworzącą ciasteczko jest;createcookie();echocookie();addcookie();setcookie();D;;;204
;358;358. W języku PHP funkcja trim ma za zadanie;Podawać długość napisu;Porównywać dwa napisy i wypisać część wspólną;Zmniejszać napis o wskazaną w parametrze liczbę znaków;Usuwać białe znaki lub inne znaki podane w parametrze, z obu końców napisu;D;;;203
;359;359. W języku JavaScript zapis w ramce oznacza, że;nazwa jest polem klasy przedmiot;nazwa jest właściwością obiektu przedmiot;zmienna x będzie przechowywać wynik działania metody nazwa;zmienna x będzie przechowywać wynik działania funkcji przedmiot;C;images/359.jpg;https://www.praktycznyegzamin.pl/inf03ee09e14/teoria/wszystko/e14/359.jpg;203
;360;360. W języku JavaScript zapisano następującą funkcję. Ma ona za zadanie;Wypisać wartość odwrotną do f;Zwrócić wartość odwrotną do f;Wypisać wartość bezwzględną z f;Zwrócić wartość bezwzględną z f;D;images/360.jpg;https://www.praktycznyegzamin.pl/inf03ee09e14/teoria/wszystko/e14/360.jpg;203
;361;361. Za pomocą języka PHP nie jest możliwe;Przetwarzanie danych formularzy;Generowanie dynamicznej zawartości strony;Przetwarzanie danych zgromadzonych w bazie danych;Zmienianie dynamiczne zawartości strony HTML w przeglądarce;D;;;204
;362;362. Działaniem przedstawionego kodu PHP będzie wypełnienie tablicy;Kolejnymi liczbami od 0 do 9 i wypisanie ich;Kolejnymi liczbami od -100 do 100 i wypisanie wartości ujemnych;10 losowymi wartościami, a następnie wypisanie wartości ujemnych;100 losowymi wartościami, a następnie wypisanie wartości dodatnich;C;images/362.jpg;https://www.praktycznyegzamin.pl/inf03ee09e14/teoria/wszystko/e14/362.jpg;204
;363;363. W języku JavaScript zapisano fragment kodu. Po wykonaniu skryptu zmienna x;Będzie równa 11 i zostanie wypisana w oknie popup;Będzie równa 10 i zostanie wypisana w dokumencie HTML;Będzie równa 11 i zostanie wypisana w konsoli przeglądarki internetowej;Będzie równa 10 i zostanie wypisana w głównym oknie przeglądarki internetowej;C;images/363.jpg;https://www.praktycznyegzamin.pl/inf03ee09e14/teoria/wszystko/e14/363.jpg;203
;364;364. W języku PHP, wykonując operacje na bazie danych MySQL, aby zakończyć pracę z bazą, należy wywołać;"mysqli_exit();";"mysqli_close();";"mysqli_commit();";"mysqli_rollback();";B;;;204
;365;365. W ramce przedstawiono kod JavaScript z błędem logicznym. Program powinien wypisywać informację, czy liczby są sobie równe czy nie, lecz nie wykonuje tego. Wskaż odpowiedź, która dotyczy błędu;Nieprawidłowo zadeklarowano zmienne;Przed klauzulą else nie powinno być średnika;W klauzuli if występuje przypisanie zamiast porównania;Instrukcje wewnątrz sekcji if oraz else powinny być zamienione miejscami;C;images/365.jpg;https://www.praktycznyegzamin.pl/inf03ee09e14/teoria/wszystko/e14/365.jpg;201
;366;366. Która z zasad tworzenia części <head> języka HTML jest poprawna?;W części <head> zawiera się część <body>;W części <head> mogą wystąpić znaczniki <meta>, <title>, <link>;W części <head> można definiować szablon strony znacznikami <div>;W części <head> nie można umieszczać kodu CSS, a jedynie odwołanie do pliku CSS;B;;;201
;367;367. W języku HTML znacznik <strong>tekst</strong> będzie wyświetlany w ten sam sposób przez przeglądarkę co znacznik;<b>tekst</b>;<h1>tekst</h1>;<big>tekst</big>;<sub>tekst</sub>;A;;;201
;368;368. Aby strona WWW była responsywna, należy między innymi definiować;jedynie znane czcionki, np. Arial;rozmiary obrazów w procentach;rozmiary obrazów wyłącznie w pikselach;rozkład strony wyłącznie za pomocą tabel;B;;;201
;369;369. W języku HTML, aby zapisać sekcję cytatu, która może zawierać kilka paragrafów tak, by przeglądarka dodała wspólne wcięcie, należy zastosować znacznik;<q>;<indent>;<blockq>;<blockquote>;D;;;201
;370;370. W języku CSS wartości underline, overline, blink przyjmują atrybut;text-style;font-style;font-weight;text-decoration;D;;;201
;371;371. W przedstawionej definicji stylu CSS, powtarzanie dotyczy;tła każdego ze znaczników akapitu;rysunku umieszczonego znacznikiem img;rysunku umieszczonego w tle strony w pionie;rysunku umieszczonego w tle strony w poziomie;C;images/371.jpg;https://www.praktycznyegzamin.pl/inf03ee09e14/teoria/wszystko/e14/371.jpg;202
;372;372. W języku CSS zdefiniowano styl. Sformatowana stylem sekcja będzie zawierała obramowanie o szerokości;2 px oraz marginesy wewnątrz tego obramowania;20 px oraz marginesy wewnątrz tego obramowania;2 px oraz marginesy na zewnątrz tego obramowania;20 px oraz marginesy na zewnątrz tego obramowania;C;images/372.jpg;https://www.praktycznyegzamin.pl/inf03ee09e14/teoria/wszystko/e14/372.jpg;202
;373;373. Strona HTML definiuje akapit oraz rysunek. Aby rysunek został umieszczony przez przeglądarkę w tej samej linii co akapit po jego lewej stronie, należy w stylu CSS rysunku zawrzeć własność;"float:left;";"align:left;";"style:left;";"alt:left;";A;;;201
;374;374. W języku CSS określono formatowanie znacznika h1 według wzoru. Zakładając, że żadne inne formatowanie nie jest dodane do znacznika h1, wskaż sposób formatowania tego znacznika;A;B;C;D;C;images/374.jpg;https://www.praktycznyegzamin.pl/inf03ee09e14/teoria/wszystko/e14/374.jpg;201
;375;375. Aby przygotować szablon strony z trzema kolumnami ustawionymi obok siebie, można posłużyć się stylem CSS;A;B;C;D;A;images/375.jpg;https://www.praktycznyegzamin.pl/inf03ee09e14/teoria/wszystko/e14/375.jpg;202
;376;376. Przedstawiono fragment kodu HTML, który nie waliduje się poprawnie. Błąd walidacji tego fragmentu kodu będzie dotyczył;Braku cudzysłowu;Niedomknięcia znacznika br;Niedomknięcia znacznika img;Powtórzenia nazwy pliku graficznego;A;images/376.jpg;https://www.praktycznyegzamin.pl/inf03ee09e14/teoria/wszystko/e14/376.jpg;201
;377;377. Modelem barw opisującym kolor z użyciem stożka przestrzeni barw jest;CIE;HSV;CMY;CMYK;B;;;202
;378;378. Rozmycie Gaussa, wygładzanie, szum RGB są funkcjami programu do obróbki;Grafiki rastrowej;Grafiki wektorowej;Ścieżki dźwiękowej;Dźwięku w formacie MIDI;A;;;203
;379;379. Aby edytować nakładające się na siebie pojedyncze fragmenty obrazu, pozostawiając pozostałe elementy niezmienione, należy zastosować;Warstwy;Histogram;Kanał alfa;Kadrowanie;A;;;206
;380;380. W języku SQL wykorzystywanym przez bazę danych MySQL atrybut UNIQUE polecenia CREATE TABLE;Wymusza unikatowe nazwy pól tabeli;Blokuje możliwość wpisania wartości NULL;Jest stosowany tylko w przypadku pól liczbowych;Jest stosowany, jeśli wartość w kolumnie nie mogą się powtarzać;D;;;201
;381;381. Funkcja agregująca MIN języka SQL ma za zadanie policzyć;Liczbę wierszy zwróconych kwerendą;Wartość minimalną kolumny zwróconej kwerendą;długość znaków w zwróconych kwerendą rekordach;Średnią wartości różnych pól rekordu zwróconego zapytaniem;B;;;203
;382;382. Dana jest tabela o nazwie wycieczki z polami: nazwa, cena, miejsca (jako liczba wolnych miejsc). Aby dla dowolnego zbioru danych tabeli wyświetlić jedynie nazwy tych wycieczek, dla których cena jest niższa niż 2000 zł i mają przynajmniej cztery wolne miejsca, należy posłużyć się zapytaniem;"SELECT nazwa FROM wycieczki WHERE cena < 2000 AND miejsca > 3;";"SELECT nazwa FROM wycieczki WHERE cena < 2000 OR miejsca > 4;";"SELECT * FROM wycieczki WHERE cena < 2000 AND miejsca > 4;";"SELECT * FROM wycieczki WHERE cena < 2000 OR miejsca > 3;";A;;;203
;383;383. Dana jest tabela o nazwie przedmioty z polami: ocena i uczenID. Aby policzyć średnią ocen ucznia o ID równym 7, należy posłużyć się zapytaniem;"AVG SELECT ocena FROM przedmioty WHERE uczenID = 7;";"SELECT AVG(ocena) FROM przedmioty WHERE uczenID = 7;";"COUNT SELECT ocena FROM przedmioty WHERE uczenID = 7;";"SELECT COUNT(ocena) FROM przedmioty WHERE uczenID = 7;";B;;;202
;384;384. Tabela o nazwie naprawy zawiera pola: klient, czyNaprawione. Aby usunąć te rekordy, w których pole czyNaprawione jest prawdą, należy posłużyć się poleceniem;"DELETE FROM naprawy;";"DELETE naprawy WHERE czyNaprawione = TRUE;";"DELETE FROM naprawy WHERE czyNaprawione = TRUE;";"DELETE klient FROM naprawy WHERE czyNaprawione = TRUE;";C;;;205
;385;385. Formularz nadrzędny wykorzystywany do nawigacji w bazie danych pomiędzy dostępnymi w systemie formularzami, kwerendami jest nazywany formularzem;głównym;sterującym;pierwotnym;zagnieżdżonym;B;;;201
