id;question_id;question;a;b;c;d;correct;image;image_fallback;category_id
;849;849. Tabela programy zawiera pola: nazwa_programu, nazwa_producenta, rok_wydania. Aby kwerenda SELECT wybrała wszystkie nazwy producentó tak, by nazwy te nie powtarzały się, należy zapisać:;"SELECT nazwa_producenta FROM programy WHERE nazwa_producenta NOT DUPLICATE;";"SELECT DISTINCT nazwa_producenta FROM programy;";"SELECT UNIQUE nazwa_producenta FROM programy;";"SELECT nazwa_producenta FROM programy WHERE UNIQUE;";B;;;205
;850;850. Za pomocą przedstawionego polecenia można;utworzyć kopię zapasową tabeli sklep;sprawdzić spójność bazy danych sklep;naprawić błędy w tabeli sklep;utworzyć kopię zapasową bazy danych sklep;D;images/850.jpg;https://www.praktycznyegzamin.pl/inf03ee09e14/teoria/wszystko/e14/850.jpg;207
;851;851. Prześladowanie, uporczywe nękanie i zastraszanie, stosowanie przemocy psychicznej wobec podwładnego lub współpracownika w miejscu pracy, to;dyskryminacja;manipulacja;mobbing;perswazja;C;;;203
;852;852. Który znak ostrzegawczy określa strefę ochronną w otoczeniu źródła pola elektromagnetycznego?;Znak 1;Znak 2;Znak 3;Znak 4;C;images/852.jpg;https://www.praktycznyegzamin.pl/inf03ee09e14/teoria/wszystko/e14/852.jpg;207
;853;853. Na stronie WWW zdefiniowano rysunek, następnie akapit. Aby rysunek został umieszczony przez przeglądarkę w tej samej linii co akapit, po lewej stronie akapitu, należy w stylu CSS dla rysunku zapisać własność:;"float: left;";"style: left;";"align: left;";"alt: left;";A;;;202
;854;854. W ramce przedstawiono zapisane w języku CSS formatowanie selektora. Zakładając, że żadne inne formatowanie nie jest dodane, wskaż sposób formatowania znaczniki h1;Efekt 1;Efekt 2;Efekt 3;Efekt 4;B;images/854.jpg;https://www.praktycznyegzamin.pl/inf03ee09e14/teoria/wszystko/e14/854.jpg;201
;855;855. Który z podanych formatów można zapisać materiał wideo wraz ze ścieżką dźwiękową?;MP4;AAC;WMA;WAV;A;;;206
;856;856. Wskaż wynik wykonania skryptu PHP;czarny, zielony, niebieski, biały,;zielony, niebieski, czarny, biały,;biały, niebieski, zielony, czarny,;biały, czarny, niebieski, zielony,;B;images/856.jpg;https://www.praktycznyegzamin.pl/inf03ee09e14/teoria/wszystko/e14/856.jpg;203
;857;857. Który z wymienionych poniżej języków jest typowo front-endowy (wykonywany po stronie klienta)?;Perl;PHP;CSS;Node.js;C;;;207
;858;858. O zmiennej predefiniowanej $ _POST z języka PHP można powiedzieć, że;zawiera dane przesłane do skryptu z formularza;jest kopią tablicy $ _COOKIE;jest rozszerzoną wersją tablicy $ _SESSION;zawiera dane bezpośrednio przesłane do skryptu z ciasteczka;A;;;204
;859;859. Dana jest tabela uczniowie, do której wpisano rekordy jak na rysunku. Co będzie wynikiem działania przedstawionego zapytania SQL?;Suma ocen równa 14;Wartość 3.5;Liczba wierszy równa 4;Dane 4, 3, 4, 3;B;images/859.jpg;https://www.praktycznyegzamin.pl/inf03ee09e14/teoria/wszystko/e14/859.jpg;205
;860;860. Wynikiem wykonania przedstawionego kodu PHP jest wypisanie wartości;147;47;136;14;A;images/860.jpg;https://www.praktycznyegzamin.pl/inf03ee09e14/teoria/wszystko/e14/860.jpg;204
;861;"861. W języku CSS przypisano regułę: float:left; dla bloku. Reguła ta zostanie wykorzystana do";wyrównania tekstu do lewej strony;ustawienia bloków jeden pod drugim;ustawienia bloku na lewo względem innych;wyrównanie elementów tabeli do lewej strony;C;;;202
;862;862. Dokonując konwersji obrazu z 8 bitową głębią kolorów na obraz z 4 bitową głębią, liczba kolorów zmniejszy się o;256;24;240;16;C;;;202
;863;863. Jaką wartość przyjmie zmienna x po wykonaniu kodu PHP przedstawionego w ramce?;Liczby wierszy dodanych do tabeli produkty;Liczby wierszy przetworzonych zapytaniem DELETE FROM;Liczby wierszy tabeli produkty, dla których pole status jest większe od zera;Liczby wierszy znajdujących się w bazie danych;B;images/863.jpg;https://www.praktycznyegzamin.pl/inf03ee09e14/teoria/wszystko/e14/863.jpg;203
;864;864. W języku PHP przekierowanie użytkownika na inną stronę WWW jest możliwe za pomocą funkcji;"require();";"include();";"upload();";"header();";D;;;204
;865;865. W języku HTML, aby scalić w poziomie dwie sąsiednie komórki w wierszu tabeli należy zastosować atrybut;cellpadding;cellspacing;colspan;rowspan;C;;;201
;866;866. Które z formatowań NIE JEST wyrażone w języku CSS?;A;B;C;D;C;images/866.jpg;https://www.praktycznyegzamin.pl/inf03ee09e14/teoria/wszystko/e14/866.jpg;201
;867;867. Kod JavaScript wywołany zdarzeniem kliknięcia przycisku ma za zadanie;zamienić obraz1.gif na obraz2.gif;wyświetlić obraz2.gif obok obraz1.gif;zmienić styl obrazu o id równym i1;ukryć obraz2.gif;A;images/867.jpg;https://www.praktycznyegzamin.pl/inf03ee09e14/teoria/wszystko/e14/867.jpg;203
;868;868. Podane polecenie SQL ma za zadanie;Ustawić na 1 wartość pola Uczen;zwiększyć o jeden wartość kolumny id_klasy dla wszystkich rekordów tabeli Uczen;ustawić wartość kolumny id_klasy na 1 dla wszystkich rekordów w tabeli Uczen;zwiększyć o jeden wartość pola Uczen;B;images/868.jpg;https://www.praktycznyegzamin.pl/inf03ee09e14/teoria/wszystko/e14/868.jpg;205
;869;869. Która z wymienionych zasad NIE WPŁYNIE korzystnie na zwiększenie czytelności kodu?;W każdej linii kodu powinna występować tylko jedna instrukcja;Kod powinien być napisany bez wcięć i zbędnych enterów;Należy wprowadzać komentarze w trudniejszych częściach kodu;Nazwy zmiennych powinny odzwierciedlać ich zadanie;B;;;207
;870;870. W języku PHP należy zapisać warunek, który będzie spełniony, gdy zmienna $a będzie dowolną liczbą całkowitą mniejszą od -10 lub gdy zmienna $b będzie dowolną liczbą z przedziału (25, 75). Wyrażenie logiczne użyte w tym warunku ma postać;($a < -10) and (($b > 25) or ($b < 75));($a < -10) or (($b > 25) or ($b < 75));($a < -10) or (($b > 25) and ($b < 75));($a < -10) and (($b > 25) and ($b < 75));C;;;203
;871;871. Baza danych zawiera tabele artykuły z polami: nazwa, typ, producent, cena. Aby wyświetlić wszystkie nazwy artykułów wyłącznie typu pralka, dla których cena jest z przedziału 1000 PLN i 1500 PLN, należy zastosować polecenie;"SELECT nazwa FROM artykuly WHERE typ=""pralka"" OR cena BETWEEN 1000 AND 1500;";"SELECT nazwa FROM artykuly WHERE typ=""pralka"" AND cena FROM 1000 TO 1500;";"SELECT nazwa FROM artykuly WHERE typ=""pralka"" AND cena BETWEEN 1000 AND 1500;";"SELECT nazwa FROM artykuly WHERE typ=""pralka"" OR cena BETWEEN 1000 OR 1500;";C;;;205
;872;872. W języku SQL, aby zaktualizować dane w wierszach tabeli, należy zastosować polecenie;UPDATE;SELECT;ALTER TABLE;INSERT INTO;A;;;205
;873;873. Kodowanie polskich znaków można zdefiniować w języku HTML za pomocą;atrybutu znacznika <p>;znacznika <charset>;atrybutu znacznika <meta>;znacznika <title>;C;;;201
;874;"874. Poprawny zapis znacznika <img>, za pomocą którego można umieścić na stronie internetowej obraz rys.jpg przeskalowany do szerokości 120 px i wysokości 80 px z tekstem alternatywnym ""krajobraz"" to";"<img href=""rys.jpg"" height=""120px"" width=""80px"" info=""krajobraz""/>";"<img src=""rys.jpg"" height=""120px"" width=""80px"" info=""krajobraz""/>";"<img src=""rys.jpg"" width=""120px"" height=""80px"" alt=""krajobraz""/>";"<img image=""rys.jpg"" width=""120px"" height=""80px"" alt=""krajobraz""/>";C;;;201
;875;875. Które z podanych par znaczników HTML mają wizualnie to samo działanie na stronie internetowej, jeżeli żadne style CSS NIE ZOSTAŁY zdefiniowane;<p> i <h2>;<meta> i <title>;<b> i <big>;<b> i <strong>;D;;;201
;876;876. Aby edytować dane w bazie danych można posłużyć się;filtrowaniem;kwerendą SELECT;formularzem;raportem;C;;;207
;877;877. Kwerenda ma za zadanie w tabeli artykuly;usunąć kolumnę cena typu float;dodać kolumnę cena o typie float, jeśli nie istnieje;zmienić typ na float dla kolumny cena;zmienić nazwę kolumny z cena na float;C;images/877.jpg;https://www.praktycznyegzamin.pl/inf03ee09e14/teoria/wszystko/e14/877.jpg;205
;878;878. W tabeli pracownicy zdefiniowano klucz główny typu INTEGER z atrybutami NOT NULL oraz AUTO_INCREMENT. Ponadto zdefiniowano pola imie oraz nazwisko. W przypadku zastosowania przedstawionej kwerendy SQL wprowadzającej dane, w której zostało pominięte pole klucza, w bazie danych MySQL nastąpi;zignorowanie polecenia, tabela pozostanie bez zmian;wpisanie rekordu do tabeli, dla klucza głównego zostanie przydzielona wartość NULL;błąd nieprawidłowej liczby pól;wpisanie rekordu do tabeli, dla klucza głównego zostanie przydzielona kolejna wartość naturalna;D;images/878.jpg;https://www.praktycznyegzamin.pl/inf03ee09e14/teoria/wszystko/e14/878.jpg;205
;879;879. Aby obsłużyć połączenie z bazą MySQL podczas tworzenia aplikacji internetowej, można wykorzystać język;HTML;PHP;XHTML;CSS;B;;;205
;880;880. Tabele Osoby i Adresy są połączone relacją jeden do wielu. Jakie zapytanie SQL należy zapisać, aby korzystając z tej relacji, prawidłowo wyświetlić nazwiska oraz przyporządkowane im miasta?;"SELECT nazwisko, Miasto FROM Osoby JOIN Adresy ON Osoby.Adresy_id=Adresy.id;";"SELECT nazwisko, Miasto FROM Osoby.Adresy_id=Adresy.id FROM Osoby, Adresy;";"SELECT nazwisko, Miasto FROM Osoby, Adresy;";"SELECT nazwisko, Miasto FROM Osoby, Adresy WHERE Osoby.id=Adresy.id;";A;images/880.jpg;https://www.praktycznyegzamin.pl/inf03ee09e14/teoria/wszystko/e14/880.jpg;202
;881;881. W stylu CSS aby zadeklarować krój czcionki, należy użyć właściwości;font-face;font-style;font-size;font-family;D;;;202
;882;882. Która informacja dotycząca przedstawionego kodu jest prawdziwa?;"Zostanie wypisany komunikat ""OlaAla""";"W zmiennej $a wartość ""Ala"" zostanie zamieniona na wartość ""Ola""";"Znak ""="" jest operatorem porównania dwóch zmiennych";"Znak kropki ""."" jest operatorem konkatenacji";D;images/882.jpg;https://www.praktycznyegzamin.pl/inf03ee09e14/teoria/wszystko/e14/882.jpg;201
;883;883. Dana jest tabela uczniowie o polach id, imie, nazwisko, data_ur (format rrrr-mm-dd). Które zapytanie w języku SQL wyświetli tylko imiona i nazwiska uczniów urodzonych w 2001 roku?;"SELECT imie, nazwisko FROM uczniowie WHERE data_ur like ""2001-%-%""";"SELECT * FROM uczniowie WHERE data_ur like ""2001""";"SELECT id, imie, nazwisko, data_ur FROM uczniowie WHERE data_ur like ""2001-*-*""";SELECT * FROM uczniowie WHERE data_ur == 2001-%-%;A;;;205
;884;884. Fragment kodu SQL oznacza, że klucz obcy;jest referencją do samego siebie;ustawiony jest na kolumnie obiekty;znajduje się w tabeli obiekty;łączy się z kolumną imiona;D;images/884.jpg;https://www.praktycznyegzamin.pl/inf03ee09e14/teoria/wszystko/e14/884.jpg;205
;885;885. Który znacznik służy budowaniu hierarchii tekstu w języku HTML?;<u>;<style>;<head>;&lth6>;D;;;201
;886;886. Która z definicji CSS określa formatowanie nagłówka h1: tekst nadkreślony, z odstępami między wyrazami 10 px i czerwonym kolorem tekstu?;A;B;C;D;A;images/886.jpg;https://www.praktycznyegzamin.pl/inf03ee09e14/teoria/wszystko/e14/886.jpg;202
;887;887. W języku CSS, należy zdefiniować tło dokumentu jako obraz rys.png. Obraz ma powtarzać się jedynie w poziomie. Którą definicję należy przypisać selektorowi body?;"{background-image: url(""rys.png""); background-repeat: repeat-x;}";"{background-image: url(""rys.png""); background-repeat: round;}";"{background-image: url(""rys.png""); background-repeat: repeat-y;}";"{background-image: url(""rys.png""); background-repeat: repeat;}";A;;;202
;888;"888. Za pomocą którego zapisu zostanie utworzony w dokumencie HTML element wyświetlający obraz kotek.jpg z tekstem alternatywnym ""obrazek kotka""";"<img src=""kotek.jpg"" alt=""obrazek kotka"">";"<img href=""kotek.jpg"" title=""obrazek kotka"">";"<img src=""kotek.jpg"" title=""obrazek kotka"">";"<img href=""kotek.jpg"" alt=""obrazek kotka"">";A;;;201
;889;889. Przedstawione formatowanie CSS, przy założeniu, że żadne inne formatowanie nie jest zdefiniowane, sprawi, że;marginesy wewnętrzne wszystkich komórek będą wynosiły 10 px;margines wewnętrzny komórki z napisem Anna będzie miał 30 px, a z napisem Ewa – 10 px;marginesy wewnętrzne wszystkich komórek będą wynosiły 30 px;margines wewnętrzny komórki z napisem Anna będzie miał 10 px, a z napisem Ewa – 30 px;D;images/889.jpg;https://www.praktycznyegzamin.pl/inf03ee09e14/teoria/wszystko/e14/889.jpg;201
;890;890. W języku JavaScript podany w ramce fragment funkcji ma za zadanie;wyświetlić wszystkie elementy tablicy;wprowadzić do każdego elementu tablicy aktualną wartość zmiennej i;policzyć sumę wszystkich elementów tablicy;dodać do każdego elementu tablicy stałą wartość;C;images/890.jpg;https://www.praktycznyegzamin.pl/inf03ee09e14/teoria/wszystko/e14/890.jpg;203
;891;891. W języku SQL, aby wstawić wiersz danych do bazy, należy zastosować polecenie;CREATE INTO;CREATE ROW;INSERT INTO;SELECT ROW;C;;;205
;892;892. Wskaż kod CSS odpowiadający układowi bloków 2 - 5, zakładając, że są one zbudowane w oparciu o przedstawiony kod HTML;A;B;C;D;B;images/892.jpg;https://www.praktycznyegzamin.pl/inf03ee09e14/teoria/wszystko/e14/892.jpg;201
;893;893. Rozproszonym systemem kontroli wersji projektu programistycznego jest;GIT;FileZilla;TotalCommander;Eclipse;A;;;207
;894;894. Jak zdefiniować w języku CSS takie formatowanie tabeli, żeby wiersz, na którym aktualnie znajduje się kursor myszy, zmieniał kolor tła na szary;"tr:active { color: gray; }";"tr:active { background-color: gray; }";"tr:hover { background-color: gray; }";"tr:hover { color: gray; }";C;;;202
;895;895. Formatami Video obsługiwanymi w standardzie HTML5 są;Ogg, QuickTime;Ogg, AVI, MPEG;MP4, Ogg, WebM;MP4, AVI;C;;;201
;896;896. Który z typów relacji wymaga utworzenia tabeli pośredniej łączącej klucze główne obu tabel?;1..n;n..m;n..1;1..1;B;;;205
;897;897. W kodzie HTML przypisano pewne znaczniki do klasy o nazwie „nomargin”. Aby wykonać za pomocą języka JavaScript operacje na tych znacznikach, można posłużyć się funkcją;"getElement(""nomargin"")";"getElementById(""nomargin"")";"getElementsByTagName(""nomargin"")";"getElementsByClassName(""nomargin"")";D;;;201
;898;898. Kompresja bezstratna pliku graficznego gwarantuje;lepszą jakość;mniejszą liczbę warstw;rozmiar większy niż grafika oryginalna;pierwotną jakość grafiki;D;;;206
;899;899. Wskaż poprawny składniowo warunek zapisany w języku PHP i sprawdzający brak połączenia z bazą MySQL;if {mysql_connect_errno()}{};if {mysqli_connect_error()}{};if (mysqli_connect_errno()){};if (mysql_connect_error())();C;;;204
;900;900. Tabele Osoby i Zainteresowania są połączone relacją jeden do wielu. Które zapytanie SQL należy zapisać, aby korzystając z tej relacji, prawidłowo wyświetlić imiona oraz odpowiadające im hobby?;"SELECT imie, hobby FROM Osoby.Zainteresowania_id = Zainteresowania.id FROM Osoby, Zainteresowania;";"SELECT imie, hobby FROM Osoby, Zainteresowania;";"SELECT imie, hobby FROM Osoby JOIN Zainteresowania ON Osoby.Zainteresowania_id = Zainteresowania.id;";"SELECT imie, hobby FROM Osoby, Zainteresowania WHERE Osoby.id = Zainteresowania.id;";C;images/900.jpg;https://www.praktycznyegzamin.pl/inf03ee09e14/teoria/wszystko/e14/900.jpg;202
;901;901. W języku HTML, aby wstawić na stronę obraz zapisany w formacie JPG, należy zastosować znacznik;<src>;<img>;<jpg>;<table>;B;;;201
;902;902. Za pomocą, którego znacznika można wstawić listę numerowaną (uporządkowaną) w dokumencie HTML?;<li>;<ul>;<ol>;<dl>;C;;;201
;903;"903. W języku CSS zapis selektora p > i { color: red; } oznacza, że kolorem czerwonym zostanie sformatowany";jedynie ten tekst w znaczniku <i>, który jest umieszczony bezpośrednio wewnątrz znacznika <p>;jedynie ten tekst znacznika <p>, do którego jest przypisana klasa o nazwie i;każdy tekst w znaczniku <p> lub każdy tekst w znaczniku <i>;każdy tekst w znaczniku <p> za wyjątkiem tych w znaczniku <i>;A;;;202
;904;904. Język PHP posiada obsługę;sesji i ciastek;zdarzeń myszy;zdarzeń klawiatury;obiektów przeglądarki;A;;;204
;905;905. Tworząc tabelę w języku SQL zdefiniowano pole, którego wartości nie mogą się powtarzać. Do jego definicji należy zastosować atrybut;IDENTITY;UNIQUE;DEFAULT;NOT NULL;B;;;201
;906;906. Aby wskazać błędy składniowe w kodzie HTML, należy zastosować;kompilator;debugger;interpreter;walidator;D;;;201
;907;907. Projektując stronę internetową, umieszczono kod definiujący jej styl. Jaką szerokość pozostawiono na treść strony?;600 px;640 px;560 px;2 px;C;images/907.jpg;https://www.praktycznyegzamin.pl/inf03ee09e14/teoria/wszystko/e14/907.jpg;207
;908;908. Instrukcją pętli, która jest przeznaczona do wykonania określonej liczby operacji na pewnym obiekcie lub zmiennej niebędącej tablicą, jest;foreach;if;switch;for;D;;;207
;909;909. Przedstawiona funkcja, zapisana językiem JavaScript, ma za zadanie;umożliwić przejście do wskazanej lokalizacji hosta;"wyświetlić w elemencie o id = ""info"" adres hosta wskazany pierwszym odnośnikiem";wyświetlić na przycisku lokalizację hosta, a po jego wciśnięciu umożliwić przejście do wskazanej lokalizacji;"wyświetlić w elemencie o id = ""info"" nazwę hosta, z którego pochodzi wyświetlona strona";D;images/909.jpg;https://www.praktycznyegzamin.pl/inf03ee09e14/teoria/wszystko/e14/909.jpg;203
;910;910. Która cecha grafiki wektorowej jest prawdziwa?;Raz utworzoną nie można edytować;Grafika wektorowa jest niezależna od rozdzielczości;Grafika wektorowa jest nieskalowalna;Nie można przetworzyć ją na grafikę rastrową;B;;;207
;911;911. W języku PHP operatorem reszty z dzielenia jest:;&;@;%;#;C;;;204
;912;912. W formularzu HTML zastosowano znacznik <input>. Wyświetlone pole będzie służyło do wprowadzania maksymalnie;20 znaków, które są widoczne podczas wprowadzania;20 znaków, które nie są widoczne w polu tekstowym;30 znaków, które nie są widoczne w polu tekstowym;30 znaków, które są widoczne podczas wprowadzania;B;images/912.jpg;https://www.praktycznyegzamin.pl/inf03ee09e14/teoria/wszystko/e14/912.jpg;201
;913;913. Wśród czterech podstawowych kolorów modelu barw CMYK jest;brązowy;pomarańczowy;zielony;czarny;D;;;202
;914;914. Które z poleceń nadaje najniższy poziom uprawnień użytkownikowi uczen pod względem modyfikacji danych i struktury tabel?;"GRANT ALTER, SELECT ON szkola.przedmioty TO uczen;";"GRANT SELECT ON szkola.przedmioty TO uczen;";"GRANT INSERT, DROP ON szkola.przedmioty TO uczen;";"GRANT DROP ON szkola.przedmioty TO uczen;";B;;;207
;915;915. W języku PHP, aby połączyć się z bazą danych MySQL przy pomocy biblioteki mysqli, stosując zamieszczony zapis, w miejscu litery 'c' należy zapisać;nazwę bazy danych;nazwę użytkownika;lokalizację serwera bazy danych;hasło użytkownika;B;images/915.jpg;https://www.praktycznyegzamin.pl/inf03ee09e14/teoria/wszystko/e14/915.jpg;204
;916;916. Aby w JavaScript wykonać wymienione kroki, należy w znaczniku <script> umieścić kod;"A = prompt(""Podaj kwalifikację: ""); document.write(""Kwalifikacja: "".A);";"A << prompt(""Podaj kwalifikację: ""); document.write(""Kwalifikacja: "" + A);";"A = prompt(""Podaj kwalifikację: ""); document.write(""Kwalifikacja: "" + A);";"A = alert(""Podaj kwalifikację: ""); document.write(""Kwalifikacja: "" + A);";C;images/916.jpg;https://www.praktycznyegzamin.pl/inf03ee09e14/teoria/wszystko/e14/916.jpg;201
;917;917. Funkcja agregująca AVG użyta w zapytaniu ma za zadanie;zsumować koszt wszystkich usług;obliczyć średnią arytmetyczną cen wszystkich usług;wskazać najwyższą cenę za usługi;policzyć ile jest usług dostępnych w tabeli;B;images/917.jpg;https://www.praktycznyegzamin.pl/inf03ee09e14/teoria/wszystko/e14/917.jpg;203
;918;918. Kolorem o barwie niebieskiej jest kolor;#00EE00;#EE0000;#EE00EE;#0000EE;D;;;202
;919;919. Zestaw komponentów i podprogramów służący pisaniu aplikacji, który ponadto narzuca szkielet wyglądu aplikacji, jej strukturę, a czasem nawet wzorzec według którego ma powstać aplikacja, to;komponent;middleware;biblioteka;framework;D;;;207
;920;920. Rozwinięcie słowne akronimu ACID w SQL to;atomic, constaint, isolated, dependable;atomic, consistent, isolated, durable;atomic, consistent, iss, dependable;atomic, comming, is, do;B;;;202
;921;921. Które dane z 8 rekordów wpisanych do tabeli zwierzeta zostaną wyświetlone w wyniku podanego zapytania SQL?;Anna Kowalska, Jan Nowak;Dika, Fuks;Figaro, Dika, Fuks;Fafik, Brutus, Dika, Fuks;B;images/921.jpg;https://www.praktycznyegzamin.pl/inf03ee09e14/teoria/wszystko/e14/921.jpg;205
;922;"922. W języku JavaScript instrukcję a++; można inaczej zapisać jako";a&1;1+=a;a<<1;a=a+1;D;;;203
;923;923. Z którym ze słów kluczowych programowania obiektowego w języku JavaScript wiąże się dostęp do pól i metod tylko z poziomu klasy, w której są zdefiniowane;static;public;private;Żadne z powyższych, w JavaScript należy użyć #;D;;;203
;924;924. Przedstawiony na rysunku kolor zapisany w modelu RGB, w systemie szesnastkowym będzie zdefiniowany następująco;77A0C1;76A3C1;71A0B2;77A1C1;A;images/924.jpg;https://www.praktycznyegzamin.pl/inf03ee09e14/teoria/wszystko/e14/924.jpg;202
;925;925. Za pomocą której funkcji języka PHP można ustanowić połączenie z bazą danych o nazwie zwierzaki?;"$polacz = server_connect('localhost', 'root','','zwierzaki');";"$polacz = mysqli_connect('localhost', 'root','','zwierzaki');";"$polacz = sql_connect('localhost', 'root','','zwierzaki');";"$polacz = db_connect('localhost', 'root','','zwierzaki');";B;;;204
;926;926. Aby zmienić maksymalną długość pola imie w tabeli klienci na 30 znaków, należy użyć w języku SQL następującego kodu;"CHANGE TABLE klienci MODIFY imie CHAR(30);";"CHANGE TABLE klienci TO COLUMN imie SET CHAR(30);";"ALTER TABLE klienci MODIFY COLUMN imie VARCHAR(30);";"ALTER TABLE klienci CHANGE imie TEXT;";C;;;205
;927;927. Jeśli zmienna $x przechowuje dowolną liczbę naturalną dodatnią, przedstawiony kod źródłowy PHP ma za zadanie wyświetlić;kolejne liczby od x do 0;liczby wczytywane z klawiatury, tak długo aż zostanie wczytana wartość x;losowe liczby z przedziału (0, x);kolejne liczby od 0 do x-1;D;images/927.jpg;https://www.praktycznyegzamin.pl/inf03ee09e14/teoria/wszystko/e14/927.jpg;204
;928;928. W języku JavaScript zdefiniowano obiekt. Aby dalej w kodzie modyfikować wartość właściwości x obiektu, należy zapisać;wsp.x = …;x = …;obiekt1::x = …;obiekt1.x = …;D;images/928.jpg;https://www.praktycznyegzamin.pl/inf03ee09e14/teoria/wszystko/e14/928.jpg;203
;929;929. Odpowiednia kolejność procesów przetwarzania analogowo-cyfrowego dźwięku to:;kwantyzacja, kodowanie, próbkowanie;kwantyzacja, próbkowanie, kodowanie;próbkowanie, kodowanie, kwantyzacja;próbkowanie, kwantyzacja, kodowanie;D;;;206
;930;930. Na obrazie przedstawiono wybór formatu pliku importującego bazę danych. Którego formatu należy użyć, jeżeli dane są wyeksportowane z programu Excel i zapisane tekstowo z zastosowaniem przecinka do rozdzielenia wartości pól?;XML;SQL;ESRI;CSV;D;images/930.jpg;https://www.praktycznyegzamin.pl/inf03ee09e14/teoria/wszystko/e14/930.jpg;206
;931;931. Baza danych zawiera tabelę ksiazki o polach: tytul, id_autora, data_wypoz, id_czytelnika. Każdego dnia generowany jest raport książek wypożyczonych danego dnia. Wyświetlane są jedynie tytuły książek. Która z kwerend SQL posłuży do stworzenia tego raportu?;"SELECT tytul, data_wypoz FROM ksiazki WHERE data_wypoz = CURRDATENT_E();";"SELECT * FROM ksiazki;";"SELECT tytul FROM ksiazki WHERE data_wypoz = CURRENT_DATE();";"SELECT tytul FROM ksiazki;";C;;;205
;932;932. W języku CSS zdefiniowano formatowanie dla pola edycyjnego. Tak formatowane pole edycyjne będzie miało jasnozielone tło;jeśli jest to pierwsze wystąpienie tego znacznika w dokumencie;po kliknięciu myszą w celu zapisania w nim tekstu;gdy zostanie wskazane kursorem myszy bez kliknięcia;w każdym przypadku;B;images/932.jpg;https://www.praktycznyegzamin.pl/inf03ee09e14/teoria/wszystko/e14/932.jpg;202
;933;933. W języku CSS zapisano wspólne formatowanie dla pewnej grupy znaczników. Formatowanie takich znaczników w kodzie HTML nastąpi przez atrybut;"style = ""format1""";"id = ""format1""";"div = ""format1""";"class = ""format1""";D;images/933.jpg;https://www.praktycznyegzamin.pl/inf03ee09e14/teoria/wszystko/e14/933.jpg;201
;934;934. Formatem o najwyższej rozpiętości tonalnej wśród wymienionych jest;JPEG;PNG;RAW;BMP;C;;;201
;935;935. Które z zadań programistycznych może być wykonane tylko po stronie klienta przeglądarki?;Bezpieczne wyświetlenie personalizowanej zawartości strony ze względu na prawa użytkownika aplikacji;Zapisanie danych pobranych z formularza w bazie danych powiązanej z aplikacją internetową;Sprawdzanie danych wpisywanych do pola tekstowego w czasie rzeczywistym;Sprawdzenie hasła użytkownika w bazie danych powiązanej z aplikacją internetową;C;;;207
;936;936. Która instrukcja algorytmu odpowiada graficznej reprezentacji bloku przedstawionego na rysunku?;n > 20;Wypisz n;n ← n + 5;Wykonaj podprogram sortowania tablicy t;A;images/936.jpg;https://www.praktycznyegzamin.pl/inf03ee09e14/teoria/wszystko/e14/936.jpg;207
;937;937. Która z instrukcji języka JavaScript dokona zmiany koloru tekstu na niebieski w akapicie zdefiniowanym w dokumencie HTML?;"document.getElementById(""jeden"").style.color = ""blue"";";"document.getElementById(""jeden"").style.background-color = ""blue"";";"document.getElementById(""jeden"").color = ""blue"";";"document.getElementById(""jeden"").background-color = ""blue"";";A;images/937.jpg;https://www.praktycznyegzamin.pl/inf03ee09e14/teoria/wszystko/e14/937.jpg;201
