id;question_id;question;a;b;c;d;correct;image;image_fallback;category_id
;573;573. Zadaniem przedstawionej pętli jest;wypełnienie tabeli Ksiazka danymi.;wypisanie na ekranie danych tabeli Ksiazka.;utworzenie dziesięciu obiektów typu Ksiazka.;utworzenie jednego obiektu typu mojeKsiazki.;C;images/573.jpg;https://www.praktycznyegzamin.pl/inf03ee09e14/teoria/wszystko/e14/573.jpg;207
;574;574. Która z deklaracji funkcji w języku C++ ma parametr wejściowy typu rzeczywistego, a zwraca wartość całkowitą?;"void fun1(int a);";"int fun1(float a);";"float fun1(int a);";"float fun1(void a);";B;;;207
;575;575. Jednym z wariantów testów jednostkowych jest analiza ścieżek, która polega na;testowaniu wartości brzegowych zbioru danych.;testowaniu obiektów pod względem inicjacji i zwolnienia zarezerwowanej pamięci.;określeniu punktu początkowego i końcowego oraz badaniu możliwych dróg pomiędzy tymi punktami.;utworzeniu kilku zbiorów danych o podobnym sposobie przetwarzania i użyciu ich do przeprowadzenia testu.;C;;;207
;576;576. Który sposób komentowania w języku PHP pozwala na zapis bloku komentarza w kilku liniach?;#;/ /;/* */;<!-- -->;C;;;204
;577;577. Pole lub zbiór pól jednoznacznie identyfikujący każdy pojedynczy wiersz w tabeli w bazie danych to klucz;inkrementacyjny.;podstawowy.;przestawny.;obcy.;B;;;202
;578;578. W języku SQL, aby zmienić strukturę tabeli, np. poprzez dodanie lub usunięcie kolumny, należy zastosować polecenie;UPDATE;TRUNCATE;DROP TABLE;ALTER TABLE;D;;;205
;579;579. Atrybut kolumny NOT NULL jest wymagany w przypadku;klucza podstawowego.;użycia atrybutu DEFAULT.;definicji wszystkich pól tabeli.;definicji wszystkich pól typu numerycznego.;A;;;201
;580;580. Aby za pomocą polecenia SELECT wyświetlić nazwiska osób mieszkających na osiedlu tak, aby te nazwiska nie powtarzały się, należy zapisać zapytanie w postaci;"SELECT nazwisko FROM mieszkancy ORDER BY nazwisko;";"SELECT DISTINCT nazwisko FROM mieszkancy;";"SELECT TOP 10 nazwisko FROM mieszkancy;";"SELECT AVG(nazwisko) FROM mieszkancy;";B;;;205
;581;581. Baza danych zawiera dane multimedialne, co wiąże się z przechowywaniem dużych ilości danych binarnych. Do takich danych należy zastosować typ;BLOB;ENUM;DOUBLE;LONGTEXT;A;;;204
;582;582. W tabeli Recepta pola Imie i Nazwisko dotyczą pacjenta, na którego recepta jest wydana. Którą kwerendę należy zastosować, aby dla wszystkich recept uzyskać datę wystawienia recepty oraz imię i nazwisko lekarza wystawiającego?;"SELECT Imie, Nazwisko, DataWystawienia FROM Recepta;";"SELECT Lekarz.Imie, Lekarz.Nazwisko, DataWystawienia FROM Recepta;";"SELECT Imie, DataWystawienia FROM Recepta JOIN Lekarz ON Recepta.Lekarz_id = Lekarz.id;";"SELECT Lekarz.Imie, Lekarz.Nazwisko, DataWystawienia FROM Recepta JOIN Lekarz ON Recepta.Lekarz_id = Lekarz.id;";D;images/582.jpg;https://www.praktycznyegzamin.pl/inf03ee09e14/teoria/wszystko/e14/582.jpg;207
;583;583. W bazach danych do prezentacji danych spełniających określone warunki należy utworzyć;raport.;relację.;formularz.;makropolecenie.;A;;;205
;584;584. Które polecenie służy do zmiany wartości o jeden w polu RokStudiów w tabeli Studenci dla studentów, którzy studiują na roku 1÷4?;"UPDATE Studenci, RokStudiow+1 WHERE RokStudiow < 5;";"UPDATE Studenci SET RokStudiow WHERE RokStudiow < 5;";"UPDATE RokStudiow SET RokStudiow++ WHERE RokStudiow < 5;";"UPDATE Studenci SET RokStudiow = RokStudiow+1 WHERE RokStudiow < 5;";D;;;207
;585;585. Wskaż różnicę pomiędzy poleceniami DROP TABLE i TRUNCATE TABLE.;DROP TABLE usuwa tabelę, a TRUNCATE TABLE modyfikuje w niej dane spełniające warunek.;DROP TABLE usuwa tabelę, a TRUNCATE TABLE usuwa wszystkie dane, pozostawiając pustą tabelę.;Obydwa polecenia usuwają jedynie zawartość tabeli, ale tylko polecenie DROP TABLE może być cofnięte.;Obydwa polecenia usuwają tabelę wraz zawartością, ale tylko polecenie TRUNCATE TABLE może być cofnięte.;B;;;201
;586;586. Aby nadać użytkownikowi uprawnienia do tabel w bazie danych, należy zastosować polecenie;GRANT;SELECT;CREATE;REVOKE;A;;;207
;587;587. Aby przesłać dane za pomocą funkcji mysqli_query() w skrypcie PHP, który wstawia do bazy danych dane pobrane z formularza ze strony internetowej, jako jednego z parametrów należy użyć kwerendy;INSERT INTO;UPDATE;SELECT;ALTER;A;;;204
;588;588. Przedstawiony fragment kodu PHP działa poprawnie i ma za zadanie wyświetlić na stronie internetowej dane pobrane kwerendą z bazy danych. Z ilu pól zostaną wyświetlone dane?;Z jednego pola.;Z dwóch pól.;Z trzech pól.;Z czterech pól.;C;images/588.jpg;https://www.praktycznyegzamin.pl/inf03ee09e14/teoria/wszystko/e14/588.jpg;204
;589;589. Na rysunku przedstawiono strukturę bloków strony internetowej. Który z fragmentów formatowania strony pasuje do takiego układu? (Dla uproszczenia pominięto właściwości koloru tła, wysokości i czcionki);"#pierwszy {float:left; width:30%; } #drugi {clear:both; width:70%; } #trzeci {float:left; width:70%; } #czwarty {clear:both; }";"#pierwszy {float:left; width:30%;} #drugi {float:left; width:70%;} #trzeci {float:left; width:70%;} #czwarty {clear:both; }";"#pierwszy { width: 30%; } #drugi { width: 70%; } #trzeci { width: 70%; } #czwarty { width: 100%; }";"#pierwszy{float:left; width:30%;} #drugi {clear:both; width:70%;} #trzeci {clear:both; width:70%;} #czwarty {float:left; width:100%;}";B;images/589.jpg;https://www.praktycznyegzamin.pl/inf03ee09e14/teoria/wszystko/e14/589.jpg;201
;590;590. Wskaż nazwę Systemu Zarządzania Treścią, którego logo zostało przedstawione na rysunku.;Drupal;Joomla!;WordPress;MediaWiki;B;images/590.jpg;https://www.praktycznyegzamin.pl/inf03ee09e14/teoria/wszystko/e14/590.jpg;207
;591;591. Który kod języka HTML da efekt formatowania jak na przedstawionym rysunku?;<p> W tym <i> paragrafie zobaczysz sposoby formatowania </i> tekstu w HTML </p>;<p> W tym <b> paragrafie <i> zobaczysz </i> sposoby formatowania </b> tekstu w HTML </p>;<p> W tym <i> paragrafie <b> zobaczysz </b> sposoby formatowania </i> tekstu w HTML </p>;<p> W tym <i> paragrafie </i> <b> zobaczysz </b> <i> sposoby formatowania </i> tekstu w HTML </p>;C;images/591.jpg;https://www.praktycznyegzamin.pl/inf03ee09e14/teoria/wszystko/e14/591.jpg;201
;592;592. Który znacznik należy do znaczników definiujących listy w języku HTML?;<tr>;<th>;<td>;<ul>;D;;;201
;593;593. Który z kodów HTML opisuje przedstawioną tabelę? (Dla uproszczenia pominięto zapis stylu obramowania tabeli i komórek);A;B;C;D;B;images/593.jpg;https://www.praktycznyegzamin.pl/inf03ee09e14/teoria/wszystko/e14/593.jpg;201
;594;594. Przedstawione w języku CSS formatowanie czcionki będzie obowiązywać dla;znaczników o id równym *.;znaczników z przypisaną klasą równą *.;całego kodu HTML, niezależnie od późniejszych ustawień CSS.;całego kodu HTML, jako formatowanie domyślne dla wszystkich elementów strony.;D;images/594.jpg;https://www.praktycznyegzamin.pl/inf03ee09e14/teoria/wszystko/e14/594.jpg;201
;595;595. Której właściwości CSS należy użyć, aby zdefiniować marginesy wewnętrzne dla elementu?;hight;width;margin;padding;D;;;202
;596;596. W kodzie CSS zastosowano formatowanie elementu listy, przy czym żadne inne formatowanie CSS nie zostało zdefiniowane. Zastosowane formatowanie sprawi, że;tekst wszystkich elementów, którym przypisano id „hover” będzie w kolorze Maroon.;po najechaniu kursorem na element listy, zmieni się kolor tekstu na Maroon.;tekst wszystkich elementów listy będzie w kolorze Maroon.;kolor Maroon będzie obejmował co drugi element listy.;B;images/596.jpg;https://www.praktycznyegzamin.pl/inf03ee09e14/teoria/wszystko/e14/596.jpg;201
;597;597. Wartości: static, relative, fixed, absolute oraz sticky można przypisać do właściwości;display;position;list-style-type;text-transform;B;;;207
;598;598. Aby dostosować stronę internetową dla niewidomych, należy nadać wyświetlanym za pomocą znacznika img obrazom atrybut;alt;src;text;style;A;;;201
;599;599. Którą czynność należy wykonać podczas obróbki zdjęcia w edytorze grafiki, aby białe tło zamienić na przezroczystość?;Dodać kanał alfa.;Skadrować obraz.;Zmienić saturację obrazu.;Maksymalnie zmniejszyć jasność.;A;;;202
;600;600. Aby zwiększyć szybkość działania strony zawierającej grafikę o wymiarach 2000 px na 760 px, należy zmniejszyć rozmiary grafiki;w programie graficznym.;za pomocą atrybutów HTML.;za pomocą właściwości CSS, podając rozmiar w pikselach.;za pomocą właściwości CSS, podając rozmiar w procentach.;A;;;203
;601;601. Przedstawiona linia kodu została zapisana w języku;C#;PHP;Python;JavaScript;D;images/601.jpg;https://www.praktycznyegzamin.pl/inf03ee09e14/teoria/wszystko/e14/601.jpg;207
;602;602. Na stronie internetowej znajduje się formularz, do którego należy zaprogramować następujące funkcje: - walidacja: w trakcie wypełniania formularza w czasie rzeczywistym jest sprawdzana poprawność danych - przesyłanie danych: po wypełnieniu formularza i jego zatwierdzeniu dane są przesyłane do bazy danych na serwerze Aby zaimplementować tę funkcjonalność w możliwie najprostszy sposób, należy zapisać;walidację i przesyłanie danych w języku PHP.;walidację i przesyłanie danych w języku JavaScript.;walidację w skrypcie PHP, a przesyłanie danych w JavaScript.;walidację w języku JavaScript, a przesyłanie danych w skrypcie PHP.;D;;;201
;603;603. Globalne tablice do przechowywania danych o ciastkach i sesjach: $ _ COOKIE oraz $ _ SESSION są częścią języka;C#;Perl;PHP;JavaScript;C;;;204
;604;604. Podczas walidacji dokumentu HTML5 pojawił się komunikat o treści: „Error: Element head is missing a required instance of child element title”. Oznacza to, że w dokumencie;element <title> nie jest wymagany.;element <title> nie został zamknięty przez </title>.;nie zdefiniowano elementu <title> w części <head> dokumentu.;nie zdefiniowano obowiązkowego atrybutu title w znaczniku <img>.;C;;;201
;605;605. Którego protokołu należy użyć, aby przesłać pliki strony internetowej na serwer hostingowy?;FTP;IRC;HTTP;SMTP;A;;;207
;606;606. Przedstawiony blok reprezentuje czynność;zastosowania gotowej procedury lub funkcji.;wczytania lub wyświetlenia danych.;wykonania zadania w pętli.;podjęcia decyzji.;D;images/606.jpg;https://www.praktycznyegzamin.pl/inf03ee09e14/teoria/wszystko/e14/606.jpg;207
;607;607. Aby zadeklarować pole klasy, do którego mają dostęp jedynie metody tej klasy i pole to nie jest dostępne dla klas pochodnych, należy użyć kwalifikatora dostępu;public.;private.;protected.;published.;B;;;207
;608;608. Pętla while powinna być wykonywana tak długo, jak długo zmienna x będzie przyjmowała wartości z przedziału obustronnie otwartego (-2, 5). Zapis tego warunku w nagłówku pętli za pomocą języka PHP ma postać;($x > -2) && ($x < 5);($x == -2) && ($x < 5);($x < -2) || ($x > 5);($x > -2) || ($x > 5);A;;;203
;609;609. Po wykonaniu się przedstawionego fragmentu kodu języka C/C++ zmiennej o nazwie zmienna2 zostanie;przypisany adres zmiennej o nazwie zmienna1.;przypisana ta sama wartość, co przechowywana w zmienna1.;przypisana zamieniona na łańcuch wartość przechowywana w zmienna1.;przypisana liczba w kodzie binarnym odpowiadająca wartości przechowywanej w zmienna1.;A;images/609.jpg;https://www.praktycznyegzamin.pl/inf03ee09e14/teoria/wszystko/e14/609.jpg;203
;610;610. W języku PHP float reprezentuje typ;logiczny.;całkowity.;łańcuchowy.;zmiennoprzecinkowy.;D;;;204
;611;611. Którym słowem kluczowym, w języku z rodziny C należy posłużyć się, aby przypisać alternatywną nazwę dla istniejącego typu danych?;enum;union;switch;typedef;D;;;205
;612;612. Instrukcja for może być zastąpiona instrukcją;case;while;switch;continue;B;;;207
;613;613. Przedstawiony kod źródłowy, zapisany w języku C++, ma za zadanie dla wprowadzanych dowolnych całkowitych liczb różnych od zera wypisać;liczby pierwsze;wszystkie liczby;tylko liczby parzyste;tylko liczby nieparzyste;C;images/613.jpg;https://www.praktycznyegzamin.pl/inf03ee09e14/teoria/wszystko/e14/613.jpg;207
;614;614. DOM dostarcza metod i własności, które w języku JavaScript pozwalają na;manipulowanie zadeklarowanymi w kodzie łańcuchami;wysyłanie danych formularza bezpośrednio do bazy danych;wykonywanie operacji na zmiennych przechowujących liczby;pobieranie i modyfikowanie elementów strony wyświetlonej przez przeglądarkę;D;;;203
;615;615. Testy dotyczące skalowalności oprogramowania mają za zadanie sprawdzić, czy aplikacja;ma odpowiednią funkcjonalność.;jest odpowiednio udokumentowana.;potrafi działać przy zakładanym i większym obciążeniu.;jest zabezpieczona przed niedozwolonymi operacjami, np. dzielenie przez zero.;C;;;207
;616;616. Który z komentarzy opisuje zadanie zdefiniowanej w języku PHP funkcji?;/*Funkcja zwraca wartość wyższą z dwóch podanych, gdy są równe zwraca wartość -1 */;/* Funkcja zwraca wartość niższą z dwóch podanych, gdy są równe zwraca wartość -1 */;/* Funkcja zwraca wartość wyższą z dwóch podanych, gdy są równe zwraca wartość $a */;/*Funkcja zwraca wartość niższą z dwóch podanych, gdy są równe zwraca wartość $a */;A;images/616.jpg;https://www.praktycznyegzamin.pl/inf03ee09e14/teoria/wszystko/e14/616.jpg;204
;617;617. W relacyjnych bazach danych, jeżeli dwie tabele są połączone za pomocą ich kluczy głównych, mamy do czynienia z relacją;1..1;1..n;n..1;n..n;A;;;205
;618;618. Normalizacja tabel jest procesem, który ma na celu;dodanie rekordów do bazy.;przedstawienie graficzne bazy.;jedynie utworzenie tabel i relacji w bazie.;sprawdzenie i optymalizację bazy danych.;D;;;207
;619;619. Wbudowanym w pakiet XAMPP narzędziem służącym do zarządzania bazą danych jest;MySQL Workbench;phpMyAdmin;pgAdmin;SQLite;B;;;207
;620;620. Wskaż zapytanie, w którym dane zostały posortowane.;"SELECT DISTINCT produkt, cena FROM artykuly;";"SELECT AVG(ocena) FROM uczniowie WHERE klasa = 2;";"SELECT nazwisko FROM firma WHERE pensja > 2000 LIMIT 10;";"SELECT imie, nazwisko FROM mieszkancy WHERE wiek > 18 ORDER BY wiek;";D;;;207
;621;621. Funkcją agregującą zwracającą liczbę rekordów jest;SUM;AVG;COUNT;NUMBER;C;;;207
;622;622. Dana jest tabela zwierzeta z polami nazwa, gatunek, gromada, cechy, dlugosc_zycia. Dla dowolnego zestawu danych, aby wyświetlić nazwy tych zwierząt, które żyją przynajmniej 20 lat oraz są ssakami, należy wydać zapytanie:;"SELECT nazwa FROM zwierzeta WHERE gromada = ‘ssak‘;";"SELECT nazwa FROM zwierzeta WHERE dlugosc_zycia >=20;";"SELECT nazwa FROM zwierzeta WHERE dlugosc_zycia >=20 AND gromada = ‘ssak‘;";"SELECT nazwa FROM zwierzeta WHERE dlugosc_zycia >=20 OR gromada = ‘ssak‘;";C;;;205
;623;623. W tabeli personel znajdują się pola: imie, nazwisko, pensja, staz. Aby otrzymać średnią pensję pracowników, dla których staż wynosi od 10 do 20 lat pracy włącznie, należy wykonać kwerendę:;"SELECT COUNT (pensja) FROM personel WHERE staz >= 10 AND staz <= 20;";"SELECT AVG(pensja) FROM personel WHERE staz >= 10 AND staz <= 20;";"SELECT COUNT(*) FROM personel WHERE staz >= 10 AND staz <= 20;";"SELECT AVG (*) FROM personel WHERE staz >= 10 AND staz <= 20;";B;;;207
;624;624. Zapytanie z klauzulą JOIN stosuje się, aby;wywołać funkcję agregującą.;zdefiniować klucz obcy dla tabeli.;otrzymać wynik jedynie z jednej tabeli.;uzyskać wyniki z dwóch tabel pozostających ze sobą w relacji.;D;;;205
;625;625. Aby usunąć tabelę należy zastosować kwerendę;DELETE;UNIQUE;DROP TABLE;TRUNCATE TABLE;C;;;207
;626;626. Za pomocą przedstawionego zapytania w tabeli zostanie;zmieniona nazwa kolumny z nazwa1 na nazwa2.;zmieniona wartość kolumny nazwa2 na DOUBLE.;dodana kolumna nazwa2 typu zmiennoprzecinkowego.;dodana kolumna nazwa2 przyjmująca wartość domyślną DOUBLE.;C;images/626.jpg;https://www.praktycznyegzamin.pl/inf03ee09e14/teoria/wszystko/e14/626.jpg;207
;627;627. Które tabele zostaną sprawdzone za pomocą przedstawionego polecenia?;Tabele, które zmieniły się od ostatniej kontroli lub nie zostały poprawnie zamknięte.;Jedynie tabele, które nie zostały poprawnie zamknięte.;Tabele, które zmieniły się w aktualnej sesji.;Jedynie tabele referujące do innych.;A;images/627.jpg;https://www.praktycznyegzamin.pl/inf03ee09e14/teoria/wszystko/e14/627.jpg;207
;628;628. Jakie uprawnienia będzie miał użytkownik jan po wykonaniu na bazie danych przedstawionych poleceń?;Będzie mógł zmienić strukturę tabeli klienci.;Będzie mógł usuwać rekordy z tabeli klienci.;Będzie mógł wyszukiwać dane w tabeli klienci.;Będzie mógł wstawiać rekordy do tabeli klienci.;A;images/628.jpg;https://www.praktycznyegzamin.pl/inf03ee09e14/teoria/wszystko/e14/628.jpg;207
;629;629. Witryna internetowa wysyła dane poufne za pomocą formularza do kodu PHP. Która metoda wysłania jest najbardziej bezpieczna?;Metoda GET, za pomocą protokołu HTTP;Metoda POST, za pomocą protokołu HTTP;Metoda GET, za pomocą protokołu HTTPS;Metoda POST, za pomocą protokołu HTTPS;D;;;201
;630;630. Przedstawiony fragment kodu PHP ma za zadanie umieścić dane znajdujące się w zmiennych $a, $b, $c w bazie danych, w tabeli dane. Tabela dane zawiera cztery pola, z czego pierwsze to autoinkrementowany klucz główny. Które z poleceń powinno być przypisane do zmiennej $zapytanie?;"SELECT '$a', '$b', '$c' FROM dane;";"SELECT NULL, '$a', '$b', '$c' FROM dane;";"INSERT INTO dane VALUES ('$a', '$b', '$c');";"INSERT INTO dane VALUES (NULL, '$a', '$b', '$c');";D;images/630.jpg;https://www.praktycznyegzamin.pl/inf03ee09e14/teoria/wszystko/e14/630.jpg;205
;631;631. Witryna internetowa ma mieć przedstawioną strukturę bloków. Aby uzyskać ten układ, należy znacznikom sekcji przypisać właściwości w następujący sposób:;"float tylko dla bloku 5; clear dla bloku 2";"float tylko dla bloków: 3, 4; clear dla bloku 5";"float tylko dla bloku 2; clear dla bloków: 3, 4";"float tylko dla bloków: 2, 3, 4; clear dla bloku 5";D;images/631.jpg;https://www.praktycznyegzamin.pl/inf03ee09e14/teoria/wszystko/e14/631.jpg;201
;632;632. Podstawowym zadaniem systemu CMS jest oddzielenie treści serwisu informacyjnego od jego wyglądu. Efekt ten jest uzyskany poprzez generowanie zawartości;z bazy danych oraz wyglądu ze zdefiniowanego szablonu.;z bazy danych oraz wyglądu za pomocą atrybutów HTML.;ze statycznych plików HTML oraz wyglądu ze zdefiniowanego szablonu.;ze statycznych plików HTML oraz wyglądu za pomocą technologii FLASH.;A;;;201
;633;633. W języku HTML znacznik < i > nadaje znakom taki sam wizualny efekt jak znacznik;<u>;<em>;<pre>;<strong>;B;;;201
;634;634. Przedstawiono tabelę zdefiniowaną kodem HTML, bez formatowania CSS. Który z fragmentów kodu HTML odpowiada pierwszemu wierszowi tabeli?;A;B;C;D;D;images/634.jpg;https://www.praktycznyegzamin.pl/inf03ee09e14/teoria/wszystko/e14/634.jpg;201
;635;635. Aby obraz wstawiony kodem HTML mógł być interpretowany przez programy wspomagające osoby niewidzące, należy zdefiniować atrybut;alt;src;sizes;border;A;;;201
;636;636. Na obrazie przedstawiono efekt formatowania stylami CSS oraz kod HTML generujący ten przykład. Zakładając, że marginesy wewnętrzne wynoszą 50 px, a zewnętrzne wynoszą 20 px, styl CSS dla obrazu ma postać;"img { background-color: Teal; border: 4px dotted Teal; padding: 50px; margin: 20px; }";"img { background-color: Teal; border: 4px solid black; margin: 50px; padding: 20px; }";"img { background-color: Teal; border: 4px solid black; padding: 50px; margin: 20px; }";"img { background-color: Teal; border: 4px dotted Teal; margin: 50px; padding: 20px; }";C;images/636.jpg;https://www.praktycznyegzamin.pl/inf03ee09e14/teoria/wszystko/e14/636.jpg;201
;637;637. W kodzie CSS zdefiniowano cztery klasy formatowania, których następnie użyto do formatowania paragrafów. Efekt widoczny na rysunku powstał po zastosowaniu klasy o nazwie;format1;format2;format3;format4;B;images/637.jpg;https://www.praktycznyegzamin.pl/inf03ee09e14/teoria/wszystko/e14/637.jpg;202
;638;638. W jakim formacie należy zapisać obraz, aby mógł być wyświetlony na stronie internetowej z zachowaniem przezroczystości?;JPG;BMP;PNG;CDR;C;;;201
;639;639. Na potrzeby strony internetowej przygotowano grafikę rysunek.jpg o rozmiarze: szerokość 200 px, wysokość 100 px. Aby wyświetlić tę grafikę jako miniaturę – pomniejszoną z zachowaniem proporcji, można zastosować znacznik;"<img src = ""rysunek.png"">";"<img src = ""rysunek.png"" style = ""width: 50px"">";"<img src = ""rysunek.png"" style = ""width: 25px; height: 50px"">";"<img src = ""rysunek.png"" style = ""width: 25px; height: 25px"">";B;;;201
;640;640. Której funkcji edytora grafiki rastrowej należy użyć, aby przygotować rysunek do wyświetlenia na stronie w ten sposób, żeby było widoczne tylko to, co znajduje się w ramce?;Odbicie;Skalowanie;Kadrowanie;Perspektywa;C;images/640.jpg;https://www.praktycznyegzamin.pl/inf03ee09e14/teoria/wszystko/e14/640.jpg;202
;641;641. Przedstawiony fragment dokumentu HTML z kodem JavaScript spowoduje, że po wciśnięciu przycisku;obraz1.png zostanie ukryty.;obraz2.png zostanie ukryty.;obraz2.png zostanie zastąpiony przez obraz1.png;obraz1.png zostanie zastąpiony przez obraz2.png;B;images/641.jpg;https://www.praktycznyegzamin.pl/inf03ee09e14/teoria/wszystko/e14/641.jpg;201
;642;642. Co spowoduje fragment skryptu w języku JavaScript?;Przypisze zmienną n do zmiennej s.;Wyświetli długość napisu ze zmiennej n.;Przypisze zmiennej s wartość odpowiadającą długości napisu ze zmiennej n.;Przypisze zmiennej s fragment napisu ze zmiennej n, o określonej przez zmienną length długości.;C;images/642.jpg;https://www.praktycznyegzamin.pl/inf03ee09e14/teoria/wszystko/e14/642.jpg;203
;643;643. Przedstawiony kod PHP nawiązuje połączenie z serwerem bazy danych. Jakiego typu operacje powinny się znaleźć w instrukcji warunkowej w miejscu trzech kropek?;Zamknięcie bazy danych.;Obsługa błędu połączenia.;Obsługa danych pobranych z bazy.;Komunikat o pomyślnym połączeniu z bazą.;B;images/643.jpg;https://www.praktycznyegzamin.pl/inf03ee09e14/teoria/wszystko/e14/643.jpg;203
;644;644. Który znacznik należący do sekcji head dokumentu HTML w wersji 5 jest wymagany przez walidator języka HTML, a jego brak jest zgłaszany jako błąd (error)?;title;link;metą;style;A;;;201
;645;645. Za pomocą którego protokołu można opublikować stronę internetową na serwerze?;FTP;ICMP;SMTP;NNTP;A;;;207
;646;646. W przedstawionym fragmencie algorytmu zastosowano;dwie pętle;jedną pętlę.;jeden blok decyzyjny.;trzy bloki operacyjne (procesy).;B;images/646.jpg;https://www.praktycznyegzamin.pl/inf03ee09e14/teoria/wszystko/e14/646.jpg;207
;647;647. Do optymalnej realizacji algorytmu szukającego największej z trzech podanych liczb a, b i c, wystarczy zastosować;jedną pętlę.;dwie tablice.;dwa warunki.;pięć zmiennych.;C;;;207
;648;648. Które wyrażenie logiczne w języku PHP sprawdza, czy zmienna1 należy do przedziału jednostronnie domkniętego <-5, 10)?;$zmienna1 >= -5 || $zmienna1 < 10;$zmienna1 <= -5 || $zmienna1 < 10;$zmienna1 >= -5 && $zmienna1 < 10;$zmienna1 <= -5 && $zmienna1 < 10;C;;;203
;649;649. Przedstawiona w języku C++ definicja typu wyliczeniowego sprawi, że enumerator CZWARTEK będzie równy;"napisowi ""CZWARTEK""";napisowi 'CZWARTEK';liczbie 1;liczbie 4;D;images/649.jpg;https://www.praktycznyegzamin.pl/inf03ee09e14/teoria/wszystko/e14/649.jpg;207
;650;650. Tablica tab[] jest wypełniona dowolnymi liczbami całkowitymi. Jaka wartość znajdzie się w zmiennej zm2 po wykonaniu prezentowanego fragmentu kodu?;Suma liczb z tablicy.;Suma liczb od 1 do 10.;Średnia arytmetyczna liczb z tablicy.;Średnia geometryczna liczb od 0 do 9.;C;images/650.jpg;https://www.praktycznyegzamin.pl/inf03ee09e14/teoria/wszystko/e14/650.jpg;207
;651;651. W języku JavaScript metoda getElementById odwołuje się do;zmiennej liczbowej.;klasy zdefiniowanej w CSS.;znacznika HTML o podanym id.;znacznika HTML o podanej nazwie klasy.;C;;;202
;652;652. W języku C++ funkcja zwracająca wynik potęgowania, działająca na dwóch parametrach wejściowych: liczbie x i wykładniku w, ma deklarację;"int potega(int x);";"int potega(int x, int w);";"void potega(int x, int w);";"void potega(int x, int w, int wynik);";B;;;203
;653;653. Aby skorzystać ze skryptu zapisanego w pliku przyklad.js, należy połączyć go ze stroną za pomocą kodu;<script> przyklad.js </script>;"<script src=""przyklad.js""> </script>";"<script link=""przyklad.js""> </script>";"<link rel=""script"" href=""przyklad.js"">";B;;;203
;654;654. Programista napisał w języku C++ pętlę, która miała obliczyć wynik działania 5! (5! = 1 * 2 * 3 * 4 * 5). Popełnił jednak błąd logiczny polegający na tym, że;zmienna a powinna być inicjowana wartością 0 zamiast 1.;parametr i pętli powinien być inicjowany wartością 0 zamiast 1.;parametr i pętli powinien być dekrementowany zamiast inkrementowany.;w drugim parametrze pętli powinno być porównanie i < 6 zamiast i < 5.;D;images/654.jpg;https://www.praktycznyegzamin.pl/inf03ee09e14/teoria/wszystko/e14/654.jpg;207
;655;655. Który ze sposobów komentowania kodu nie jest stosowany w kodzie PHP?;# komentarz;// komentarz;/* komentarz */;< !-- komentarz -- >;D;;;204
;656;656. Klucz obcy w tabeli jest tworzony po to, aby;łączyć go z innymi kluczami obcymi tabeli.;stworzyć formularz wpisujący dane do tabeli.;umożliwić jednoznaczną identyfikację rekordu w tabeli.;zdefiniować relację 1..n wiążącą go z kluczem głównym innej tabeli.;D;;;205
